{
  "$schema": "https://json-schema.org/draft/2020-12/schema",
  "$id": "https://ferros.local/schemas/onramp-proposal.schema.json",
  "title": "FERROS Local Onramp Proposal",
  "description": "Bounded local-only, non-evidentiary proposed-material artifact emitted by ferros-hub during the local onramp rehearsal path. This proposal remains quarantined pending consent and is not canonical FERROS state, a grant, or a partner-facing contract.",
  "type": "object",
  "required": [
    "source",
    "proposalId",
    "bridgeAgentName",
    "standInEntityName",
    "requestedCapability",
    "requestedAction",
    "quarantineStatus",
    "scope",
    "evidence",
    "localArtifactPath"
  ],
  "additionalProperties": false,
  "properties": {
    "source": {
      "$ref": "#/$defs/safeHubPath"
    },
    "proposalId": {
      "$ref": "#/$defs/safeSlug"
    },
    "bridgeAgentName": {
      "$ref": "#/$defs/safeSlug"
    },
    "standInEntityName": {
      "$ref": "#/$defs/safeSlug"
    },
    "requestedCapability": {
      "$ref": "#/$defs/safeCapability"
    },
    "requestedAction": {
      "$ref": "#/$defs/safeSlug"
    },
    "quarantineStatus": {
      "const": "quarantined-pending-consent"
    },
    "scope": {
      "const": "local-only"
    },
    "evidence": {
      "const": "non-evidentiary"
    },
    "localArtifactPath": {
      "$ref": "#/$defs/safeHubPath"
    }
  },
  "$defs": {
    "safeSlug": {
      "type": "string",
      "minLength": 1,
      "pattern": "^(?!.*(?:[Hh][Aa][Rr][Dd][Ww][Aa][Rr][Ee]|[Pp][Rr][Oo][Oo][Ff]|[Ll][Aa][Uu][Nn][Cc][Hh]|[Hh][Oo][Mm][Ee] [Aa][Ss][Ss][Ii][Ss][Tt][Aa][Nn][Tt]|[Pp][Aa][Rr][Tt][Nn][Ee][Rr]|[Gg][Aa][Tt][Ee]|[Gg]4|[Cc][Ll][Oo][Ss][Uu][Rr][Ee]|[Aa][Cc][Cc][Ee][Pp][Tt][Ee][Dd]|[Cc][Aa][Nn][Oo][Nn][Ii][Cc][Aa][Ll]|[Gg][Rr][Aa][Nn][Tt][Ee][Dd]))[a-z0-9-]+$"
    },
    "safeCapability": {
      "type": "string",
      "minLength": 1,
      "pattern": "^(?!.*://)(?!.*(?:[Hh][Aa][Rr][Dd][Ww][Aa][Rr][Ee]|[Pp][Rr][Oo][Oo][Ff]|[Ll][Aa][Uu][Nn][Cc][Hh]|[Hh][Oo][Mm][Ee] [Aa][Ss][Ss][Ii][Ss][Tt][Aa][Nn][Tt]|[Pp][Aa][Rr][Tt][Nn][Ee][Rr]|[Gg][Aa][Tt][Ee]|[Gg]4|[Cc][Ll][Oo][Ss][Uu][Rr][Ee]|[Aa][Cc][Cc][Ee][Pp][Tt][Ee][Dd]|[Cc][Aa][Nn][Oo][Nn][Ii][Cc][Aa][Ll]|[Gg][Rr][Aa][Nn][Tt][Ee][Dd]))[a-z0-9.-]+$"
    },
    "safeHubPath": {
      "type": "string",
      "pattern": "^(?!.*://)(?!.*:)(?!.*(?:^|/)\\.\\.(?:/|$))(?!.*(?:[Hh][Aa][Rr][Dd][Ww][Aa][Rr][Ee]|[Pp][Rr][Oo][Oo][Ff]|[Ll][Aa][Uu][Nn][Cc][Hh]|[Hh][Oo][Mm][Ee] [Aa][Ss][Ss][Ii][Ss][Tt][Aa][Nn][Tt]|[Pp][Aa][Rr][Tt][Nn][Ee][Rr]|[Gg][Aa][Tt][Ee]|[Gg]4|[Cc][Ll][Oo][Ss][Uu][Rr][Ee]|[Aa][Cc][Cc][Ee][Pp][Tt][Ee][Dd]|[Cc][Aa][Nn][Oo][Nn][Ii][Cc][Aa][Ll]|[Gg][Rr][Aa][Nn][Tt][Ee][Dd]))\\.tmp/hub/.+\\.json$"
    }
  }
}